[
  {
    "announced_at": "2026-06-11T00:00:00Z",
    "confidence": "confirmed",
    "date_confidence": "exact",
    "detail": {
      "kind": "rate_limit_change",
      "rate_items": [
        {
          "change": "Codex app 26.609 added rate-limit reset banking for Plus users, including an initial free reset and referral invitations during the launch promotion.",
          "scope": "plan:chatgpt-plus"
        },
        {
          "change": "Codex app 26.609 added rate-limit reset banking for Pro users, including an initial free reset and referral invitations during the launch promotion.",
          "scope": "plan:chatgpt-pro"
        },
        {
          "change": "Codex app 26.609 added a separate Business referral path where eligible members can invite coworkers to earn shared workspace credits.",
          "scope": "plan:chatgpt-business"
        }
      ],
      "schema_version": "apw.event_detail.v0"
    },
    "effective_at": "2026-06-11T00:00:00Z",
    "event_date": "2026-06-11",
    "event_kind": "rate_limit_change",
    "evidence_refs": [
      {
        "authority": "official_docs",
        "content_sha256": "47fd9b7d659da01be202a4313cbf35718c5b0544463e240dca2e13c411f355b5",
        "license_note": "Official Codex changelog reviewed for factual metadata; no provider prose copied.",
        "retrieved_at": "2026-06-12T10:40:30Z",
        "selector": "announcement:aab6a574450e9f37",
        "snapshot_ref": "entry:aab6a574450e9f37",
        "source_key": "openai.codex_docs",
        "url": "https://developers.openai.com/codex/changelog"
      }
    ],
    "expires_at": null,
    "id": "2026-06-11-openai-codex-app-rate-limit-reset-computer-use",
    "impacts": [
      {
        "api_usage_impact": "possible",
        "confidence": "confirmed",
        "direction": "added",
        "impact_kind": "rate_limit",
        "recommended_action": "Review Codex Plus, Pro, and Business usage policies before relying on reset banking or referral-earned credits in automation planning.",
        "scope_ref": "app:codex",
        "scope_type": "agent_app",
        "severity": "high",
        "subscription_impact": "direct",
        "who_should_care": [
          "coding_agent_users",
          "platform_engineers",
          "finops"
        ]
      },
      {
        "api_usage_impact": "possible",
        "confidence": "confirmed",
        "direction": "added",
        "impact_kind": "availability",
        "recommended_action": "Re-check Codex Computer Use enablement, regional eligibility, and per-app access controls before changing browser or desktop automation runbooks.",
        "scope_ref": "app:codex",
        "scope_type": "agent_app",
        "severity": "medium",
        "subscription_impact": "direct",
        "who_should_care": [
          "coding_agent_users",
          "platform_engineers",
          "security_engineers"
        ]
      },
      {
        "api_usage_impact": "possible",
        "confidence": "confirmed",
        "direction": "changed",
        "impact_kind": "quality",
        "recommended_action": "Retest browser-debugging workflows that depend on console, network, runtime-error, or page-state inspection because Developer mode adds deeper browser access paths.",
        "scope_ref": "app:codex",
        "scope_type": "agent_app",
        "severity": "medium",
        "subscription_impact": "possible",
        "who_should_care": [
          "platform_engineers",
          "reliability_engineers",
          "coding_agent_users"
        ]
      }
    ],
    "lifecycle_status": "reviewed",
    "limitations": [
      "APW records official changelog facts only; exact tenant eligibility, referral promotion availability, reset quantities, regional Computer Use availability, and app rollout timing may vary.",
      "No raw changelog body is copied into the event."
    ],
    "migration_deadline": null,
    "observed_at": "2026-06-12T10:40:30Z",
    "provider_refs": [
      "provider:openai"
    ],
    "schema_version": "apw.provider_event.v0",
    "severity": "high",
    "source_authority": "official_docs",
    "summary": "OpenAI's Codex app 26.609 changelog records rate-limit reset banking for Plus and Pro users, shared Business workspace credit referrals, Developer mode browser debugging, and expanded Computer Use controls and availability.",
    "tags": [
      "source:official_docs",
      "provider:openai",
      "impact:rate_limit_change",
      "impact:workflow_behavior_change",
      "app:codex"
    ],
    "title": "OpenAI Codex App Added Rate-Limit Reset Banking And Computer Use Controls"
  }
]
