{
  "schema_version": "apw.provider_event.v0",
  "id": "2026-06-16-aws-transform-model-migration-assessment",
  "title": "AWS Transform Added Model-To-Model Migration Assessment For GenAI Workloads",
  "event_kind": "workflow_behavior_change",
  "lifecycle_status": "reviewed",
  "provider_refs": [
    "provider:aws-bedrock"
  ],
  "event_date": "2026-06-16",
  "date_confidence": "exact",
  "observed_at": "2026-06-17T02:17:05Z",
  "announced_at": "2026-06-16T00:00:00Z",
  "effective_at": "2026-06-16T00:00:00Z",
  "expires_at": null,
  "migration_deadline": null,
  "summary": "AWS announced AWS Transform support for model-to-model migration assessment of generative AI workloads, including model mapping to Bedrock equivalents, cost comparisons, prompt-caching analysis, lifecycle awareness, and production-ready code changes.",
  "severity": "medium",
  "confidence": "confirmed",
  "source_authority": "official_blog",
  "evidence_refs": [
    {
      "source_key": "aws_bedrock.whats_new",
      "url": "https://aws.amazon.com/about-aws/whats-new/2026/06/aws-transform-model-to-model-assessments",
      "retrieved_at": "2026-06-17T02:17:05Z",
      "authority": "official_blog",
      "content_sha256": "96fe6009fc0e3548cbce7266df4c49b50443c2a8adb0e5297ed39478f37f2ff5",
      "snapshot_ref": "entry:c007f28dfbb2acf6",
      "selector": "announcement:c007f28dfbb2acf6",
      "license_note": "Official source reviewed for factual metadata; no provider prose copied."
    }
  ],
  "impacts": [
    {
      "scope_type": "provider_surface",
      "scope_ref": "surface:aws-bedrock/api",
      "impact_kind": "migration",
      "direction": "added",
      "severity": "medium",
      "confidence": "confirmed",
      "subscription_impact": "possible",
      "api_usage_impact": "direct",
      "who_should_care": [
        "platform_engineers",
        "finops",
        "product_engineers"
      ],
      "recommended_action": "Use the assessment output as review input when migrating OpenAI, Gemini, Anthropic SDK, LiteLLM, or Ollama workloads toward Bedrock; do not apply generated code changes without normal review."
    },
    {
      "scope_type": "gateway",
      "scope_ref": "gateway:litellm",
      "impact_kind": "cost",
      "direction": "changed",
      "severity": "medium",
      "confidence": "confirmed",
      "subscription_impact": "none",
      "api_usage_impact": "possible",
      "who_should_care": [
        "finops",
        "platform_engineers"
      ],
      "recommended_action": "Compare APW and AWS Transform cost findings before changing multi-provider routing defaults."
    }
  ],
  "detail": {
    "kind": "generic_change",
    "schema_version": "apw.event_detail.v0",
    "change_summary": "AWS Transform added generative-AI model migration assessment that can compare current model usage with Bedrock alternatives and surface code, prompt-caching, lifecycle, and cost recommendations."
  },
  "tags": [
    "source:official_blog",
    "provider:aws_bedrock",
    "impact:migration",
    "surface:aws_bedrock",
    "gateway:litellm"
  ],
  "limitations": [
    "APW records the AWS migration-assessment feature as provider-change context; it does not validate generated migrations or AWS cost estimates."
  ]
}
