[
  {
    "announced_at": "2026-06-01T00:00:00Z",
    "confidence": "confirmed",
    "date_confidence": "exact",
    "detail": {
      "change_summary": "OpenAI announced that OpenAI frontier models and Codex are generally available on AWS, including Amazon Bedrock and AWS governance channels.",
      "kind": "generic_change",
      "schema_version": "apw.event_detail.v0"
    },
    "effective_at": "2026-06-01T00:00:00Z",
    "event_date": "2026-06-01",
    "event_kind": "billing_channel_change",
    "evidence_refs": [
      {
        "authority": "official_blog",
        "content_sha256": "d47637ab003f5f18e59c5a59d6adf6f4d60edf48b4abd4b4db52f6fc794e8984",
        "license_note": "Official announcement reviewed for factual metadata; no provider prose copied.",
        "retrieved_at": "2026-06-08T08:40:40Z",
        "selector": "OpenAI on AWS general availability announcement",
        "snapshot_ref": "reviewed-source:2026-06-08",
        "source_key": "openai.news",
        "url": "https://openai.com/index/openai-frontier-models-and-codex-are-now-available-on-aws/"
      }
    ],
    "expires_at": null,
    "id": "2026-06-01-openai-codex-aws-bedrock-ga",
    "impacts": [
      {
        "api_usage_impact": "direct",
        "confidence": "confirmed",
        "direction": "added",
        "impact_kind": "availability",
        "recommended_action": "Evaluate whether AWS-native procurement, IAM, network controls, and Bedrock governance change the preferred route for OpenAI model or Codex adoption.",
        "scope_ref": "surface:aws-bedrock/api",
        "scope_type": "provider_surface",
        "severity": "high",
        "subscription_impact": "direct",
        "who_should_care": [
          "platform_engineers",
          "product_engineers",
          "security_engineers",
          "finops"
        ]
      },
      {
        "api_usage_impact": "direct",
        "confidence": "confirmed",
        "direction": "added",
        "impact_kind": "availability",
        "recommended_action": "Compare Codex feature availability and data-governance controls across ChatGPT sign-in, OpenAI API key, and Amazon Bedrock API key configurations.",
        "scope_ref": "app:codex",
        "scope_type": "agent_app",
        "severity": "high",
        "subscription_impact": "direct",
        "who_should_care": [
          "coding_agent_users",
          "platform_engineers",
          "security_engineers"
        ]
      },
      {
        "api_usage_impact": "direct",
        "confidence": "high",
        "direction": "added",
        "impact_kind": "compliance",
        "recommended_action": "For regulated workloads, verify region availability, feature parity, and account approvals before migrating provider access paths.",
        "scope_ref": "region:aws-govcloud",
        "scope_type": "cloud_region",
        "severity": "medium",
        "subscription_impact": "direct",
        "who_should_care": [
          "security_engineers",
          "platform_engineers",
          "product_engineers"
        ]
      }
    ],
    "lifecycle_status": "reviewed",
    "limitations": [
      "APW records availability and channel facts only; it does not assert feature parity, account eligibility, or exact AWS regional coverage beyond the official announcement."
    ],
    "migration_deadline": null,
    "observed_at": "2026-06-08T08:40:40Z",
    "provider_refs": [
      "provider:openai",
      "provider:aws-bedrock"
    ],
    "schema_version": "apw.provider_event.v0",
    "severity": "high",
    "source_authority": "official_blog",
    "summary": "OpenAI announced general availability of OpenAI frontier models and Codex on AWS, adding an AWS procurement, governance, and deployment channel for affected customers.",
    "tags": [
      "source:official_blog",
      "provider:openai",
      "provider:aws-bedrock",
      "impact:billing_channel_change",
      "app:codex"
    ],
    "title": "OpenAI Frontier Models And Codex Became Available On AWS"
  }
]
